JobTitle,TechnicalSkills,Frameworks,VersionControl,SoftSkills,Tools,
Process Engineer,"Process Design, Fluid Mechanics, PID Control","MATLAB, Simulink, Aspen Plus",Git,"Problem Solving, Teamwork","Aspen Plus, Simulink",
Chemical Process Engineer,"Process Optimization, Heat Transfer, Fluid Mechanics","COMSOL Multiphysics, Aspen Plus, MATLAB",Git,"Teamwork, Leadership","MATLAB, SolidWorks",
Manufacturing Engineer,"Process Control, Materials Science, Chemical Reaction Engineering","SolidWorks, AutoCAD, Fusion 360",Git,"Time Management, Leadership","LabVIEW, Excel",
Chemical Safety Engineer,"Risk Assessment, Process Safety, Chemical Reaction Engineering","MATLAB, PHAST, Simulink",Git,"Attention to Detail, Communication","Simulink, LabVIEW",
Production Manager,"Production Planning, Process Simulation, Material Science","Python (Pandas), Microsoft Power BI, Tableau",Git,"Leadership, Communication","MS Project, SAP",
Quality Control Engineer,"Quality Assurance, Process Control, Chemical Testing","LabVIEW, MATLAB, Python (with Pandas)",Git,"Time Management, Attention to Detail","Excel, LabVIEW",
R&D Chemical Engineer,"Chemical Synthesis, Chemical Reactions, Process Optimization","MATLAB, Simulink, COMSOL Multiphysics",Git,"Creative Thinking, Problem Solving","LabVIEW, Simulink",
Process Design Engineer,"Process Engineering, Fluid Mechanics, Reaction Engineering","AutoCAD, SolidWorks, Aspen Plus",Git,"Analytical Thinking, Problem Solving","MATLAB, Excel",
Environmental Engineer,"Environmental Protection, Process Analysis, Chemical Engineering","COMSOL Multiphysics, MATLAB, EnergyPlus",Git,"Team Collaboration, Analytical Thinking","AutoCAD, SolidWorks",
Control Systems Engineer,"Control Theory, Process Control, PLC Programming","Simulink, MATLAB, LabVIEW",Git,"Problem Solving, Communication","LabVIEW, SCADA",
Chemical Production Supervisor,"Production Management, Reaction Kinetics, Materials Science","LabVIEW, Rockwell Studio 5000, Wonderware",Git,"Leadership, Communication","Excel, SAP",
Chemical Plant Manager,"Process Management, Chemical Engineering, Plant Operations","Microsoft Power BI, Tableau, OSISoft PI System",Git,"Leadership, Decision Making","MS Project, SAP",
Automation Engineer,"Automation Systems, Process Control, PLC","PLC Programming (Siemens TIA Portal), Rockwell Studio 5000, MATLAB",Git,"Problem Solving, Creativity","SCADA, Excel",
Chemical Operations Engineer,"Operations Management, Process Safety, Fluid Mechanics","Aspen Plus, MATLAB, Simulink",Git,"Leadership, Communication","MATLAB, Simulink",
Process Optimization Engineer,"Process Optimization, Heat Transfer, Fluid Dynamics","MATLAB, Simulink, Aspen Plus",Git,"Time Management, Analytical Thinking","MATLAB, LabVIEW",
Plant Engineer,"Plant Operations, Process Safety, Materials Engineering","AutoCAD, Revit, SolidWorks",Git,"Problem Solving, Team Collaboration","Simulink, SAP",
Chemical Engineering Consultant,"Process Design, Optimization, Chemical Reactions","MATLAB, Aspen Plus, COMSOL Multiphysics",Git,"Analytical Thinking, Communication","AutoCAD, Excel",
Pharmaceutical Process Engineer,"Pharmaceutical Manufacturing, Process Engineering, Chemical Reactions","MATLAB, Simulink, COMSOL Multiphysics",Git,"Attention to Detail, Teamwork","Simulink, Excel",
Energy Engineer,"Energy Management, Heat Transfer, Thermodynamics","EnergyPlus, MATLAB, HOMER Energy",Git,"Collaboration, Problem Solving","AutoCAD, Simulink",
Biochemical Engineer,"Biochemical Process, Microbial Engineering, Process Optimization","MATLAB, COMSOL Multiphysics, Aspen Plus",Git,"Collaboration, Analytical Thinking","Aspen Plus, LabVIEW",
Materials Engineer,"Materials Science, Materials Testing, Process Engineering","ANSYS, COMSOL Multiphysics, MATLAB",Git,"Creative Thinking, Problem Solving","MATLAB, LabVIEW",
Process Control Specialist,"Process Control, Chemical Engineering, PID Control","Honeywell Experion, MATLAB, Simulink",Git,"Analytical Thinking, Attention to Detail","LabVIEW, Aspen Plus",
Senior Process Engineer,"Process Optimization, Chemical Engineering, Reactor Design","Aspen HYSYS, MATLAB, COMSOL Multiphysics",Git,"Leadership, Problem Solving","AutoCAD, Simulink",
Production Supervisor,"Production Planning, Materials Science, Process Control","PLC Programming (Rockwell Studio 5000), MATLAB, LabVIEW",Git,"Leadership, Time Management","AutoCAD, SolidWorks",
Chemical Design Engineer,"Chemical Design, Process Control, Heat Transfer","AutoCAD, AutoCAD Plant 3D, SolidWorks",Git,"Problem Solving, Team Collaboration","MATLAB, Aspen Plus",
Energy Process Engineer,"Energy Efficiency, Process Control, Thermodynamics","MATLAB, Simulink, EnergyPlus",Git,"Teamwork, Problem Solving","AutoCAD, Aspen Plus",
Research Scientist,"Chemical Reactions, Laboratory Techniques, Process Research","R, MATLAB, Python",Git,"Creative Thinking, Analytical Thinking","Simulink, AutoCAD",
Plant Operations Manager,"Operations Management, Chemical Engineering, Process Safety","OSISoft PI System, Microsoft Power BI, Tableau",Git,"Decision Making, Communication","SAP, Excel",
Project Manager, Chemical Engineering,"Microsoft Project, Asana, Trello","AutoCAD, Aspen Plus",Git,"Leadership, Teamwork","Excel, MS Project"
Chemical Engineering Intern,"Chemical Engineering, Process Design, Research","MATLAB, Python, Simulink",Git,"Time Management, Attention to Detail","LabVIEW, Excel",
Quality Assurance Specialist,"Quality Control, Chemical Testing, Process Control","LabVIEW, MATLAB, TestComplete",Git,"Attention to Detail, Communication","MATLAB, Excel",
Safety Engineer,"Safety Engineering, Process Safety, Risk Assessment","MATLAB, PHAST, Simulink",Git,"Problem Solving, Attention to Detail","AutoCAD, Simulink",
Product Development Engineer,"Product Design, Chemical Engineering, Prototype Development","MATLAB/Simulink, SolidWorks, AutoCAD",Git,"Team Collaboration, Creativity","AutoCAD, SolidWorks",
Chemical Manufacturing Engineer,"Manufacturing Processes, Chemical Engineering, Process Design","MATLAB, Aspen Plus, Simulink",Git,"Leadership, Teamwork","MATLAB, Excel",
R&D Process Engineer,"Process Research, Chemical Reactions, Simulation","MATLAB, Simulink, COMSOL Multiphysics",Git,"Innovative Thinking, Problem Solving","MATLAB, AutoCAD",
Regulatory Compliance Specialist,"Regulatory Affairs, Process Control, Chemical Engineering","MasterControl, Veeva Vault, TrackWise",Git,"Attention to Detail, Communication","MATLAB, LabVIEW",
Materials Science Engineer,"Materials Engineering, Structural Testing, Chemical Engineering","ANSYS, COMSOL Multiphysics, MATLAB",Git,"Analytical Thinking, Problem Solving","MATLAB, Excel",
Supply Chain Engineer,"Supply Chain Optimization, Process Design, Chemical Engineering","SAP SCM, Microsoft Power BI, Tableau",Git,"Communication, Problem Solving","SAP, SolidWorks",
Environmental Health Engineer,"Environmental Compliance, Chemical Processes, Safety Systems","MATLAB, COMSOL Multiphysics, ArcGIS",Git,"Team Collaboration, Analytical Thinking","Simulink, ArcGIS",
Pharmaceutical Research Engineer,"Drug Development, Process Engineering, Chemical Synthesis","MATLAB, Simulink, COMSOL Multiphysics",Git,"Analytical Thinking, Attention to Detail","LabVIEW, Excel",
Technical Sales Engineer,"Sales Engineering, Process Control, Chemical Systems","Salesforce, HubSpot, Zoho CRM",Git,"Negotiation, Communication","MATLAB, Aspen Plus",
Process Safety Manager,"Process Safety, Hazard Analysis, Risk Assessment","PHAST, MATLAB, SIMATIC PCS 7",Git,"Leadership, Decision Making","Excel, Aspen Plus",
Operations Research Engineer,"Operations Research, Process Engineering, Statistical Analysis","MATLAB, Python (SciPy), Gurobi",Git,"Problem Solving, Analytical Thinking","Excel, AutoCAD",
Chemical Equipment Engineer,"Equipment Design, Process Engineering, System Design","AutoCAD, SolidWorks, Inventor",Git,"Technical Writing, Problem Solving","Simulink, Excel",
Plant Design Engineer,"Plant Engineering, Process Design, Fluid Mechanics","AutoCAD, AutoCAD Plant 3D, Revit",Git,"Problem Solving, Analytical Thinking","MATLAB, SolidWorks",
Production Planning Engineer,"Production Planning, Chemical Engineering, Process Control","SAP APO, Oracle Primavera, Microsoft Project",Git,"Leadership, Communication","AutoCAD, MATLAB",
Quality Control Specialist,"Quality Control, Chemical Testing, Process Analysis","LabVIEW, MATLAB, TestComplete",Git,"Attention to Detail, Communication","MATLAB, Excel",
Chemical Process Consultant,"Process Analysis, Chemical Design, Process Optimization","Aspen Plus, COMSOL Multiphysics, MATLAB",Git,"Analytical Thinking, Communication","MATLAB, LabVIEW",
Energy Efficiency Engineer,"Energy Systems, Process Control, Thermodynamics","EnergyPlus, MATLAB, HOMER Energy",Git,"Problem Solving, Teamwork","AutoCAD, SolidWorks",
Chemical Systems Engineer,"Chemical Systems, Process Control, System Design","Simulink, MATLAB, Aspen Plus",Git,"Teamwork, Analytical Thinking","AutoCAD, Simulink",
Process Modeling Engineer,"Process Modeling, Chemical Engineering, Simulation","MATLAB, Simulink, Aspen Plus",Git,"Critical Thinking, Problem Solving","MATLAB, AutoCAD",
Petrochemical Engineer,"Petrochemical Engineering, Process Design, Fluid Mechanics","Aspen HYSYS, COMSOL Multiphysics, MATLAB",Git,"Communication, Problem Solving","MATLAB, Simulink",
Chemical Process Trainer,"Process Design, Chemical Reactions, Safety Procedures","MATLAB, Simulink, LabVIEW",Git,"Communication, Teaching","MATLAB, AutoCAD",
Chemical Research Engineer,"Process Research, Laboratory Techniques, Chemical Reactions","MATLAB, Simulink, COMSOL Multiphysics",Git,"Innovative Thinking, Analytical Thinking","MATLAB, AutoCAD",
Water Treatment Engineer,"Water Purification, Process Design, Chemical Engineering","COMSOL Multiphysics, MATLAB, EPANET",Git,"Problem Solving, Attention to Detail","Simulink, LabVIEW",
Energy Process Optimization Engineer,"Energy Optimization, Process Control, Thermodynamics","MATLAB, Simulink, HOMER Energy",Git,"Leadership, Problem Solving","AutoCAD, SolidWorks",
Chemical Equipment Specialist,"Process Equipment, System Design, Chemical Engineering","AutoCAD, SolidWorks, Inventor",Git,"Problem Solving, Technical Writing","MATLAB, LabVIEW",
Chemical Simulation Engineer,"Chemical Simulations, Process Design, Modeling","MATLAB, Simulink, COMSOL Multiphysics",Git,"Problem Solving, Teamwork","AutoCAD, Simulink",
Energy Systems Process Engineer,"Energy Management, Process Optimization, Heat Transfer","MATLAB, EnergyPlus, HOMER Energy",Git,"Leadership, Collaboration","AutoCAD, SolidWorks",
Pharmaceutical Manufacturing Engineer,"Pharmaceutical Engineering, Chemical Reactions, Process Control","MATLAB, Simulink, COMSOL Multiphysics",Git,"Attention to Detail, Communication","MATLAB, AutoCAD",
Petrochemical Process Specialist,"Petrochemical Engineering, Reaction Kinetics, Process Optimization","Aspen HYSYS, COMSOL Multiphysics, MATLAB",Git,"Analytical Thinking, Problem Solving","AutoCAD, SolidWorks",
Biotechnology Process Engineer,"Biotech Engineering, Bioreactor Design, Process Optimization","MATLAB, COMSOL Multiphysics, Simulink",Git,"Creativity, Analytical Thinking","AutoCAD, LabVIEW",
Materials Process Engineer,"Material Science, Process Design, Reaction Engineering","ANSYS, COMSOL Multiphysics, MATLAB",Git,"Teamwork, Attention to Detail","SolidWorks, Simulink",
Energy Process Analyst,"Energy Analysis, Process Optimization, Chemical Engineering","HOMER Energy, EnergyPlus, MATLAB",Git,"Analytical Thinking, Communication","Aspen Plus, LabVIEW",
Chemical Process Improvement Engineer,"Process Optimization, Chemical Engineering, Efficiency Improvement","Lean Six Sigma, MATLAB, Simulink",Git,"Problem Solving, Analytical Thinking","AutoCAD, Simulink",
Environmental Process Engineer,"Environmental Compliance, Process Design, Chemical Engineering","COMSOL Multiphysics, MATLAB, EnergyPlus",Git,"Collaboration, Problem Solving","AutoCAD, SolidWorks",
Process Simulation Expert,"Process Simulation, Modeling, Chemical Engineering","Aspen Plus, MATLAB, Simulink",Git,"Creative Thinking, Attention to Detail","Simulink, AutoCAD",
R&D Chemical Process Engineer,"Research and Development, Chemical Reactions, Process Design","MATLAB, Simulink, COMSOL Multiphysics",Git,"Innovation, Problem Solving","AutoCAD, Simulink",
Chemical Design Specialist,"Chemical Process Design, Reaction Engineering, Simulation","AutoCAD, AutoCAD Plant 3D, SolidWorks",Git,"Analytical Thinking, Creativity","AutoCAD, LabVIEW",
Oil & Gas Process Designer,"Oil & Gas Engineering, Process Control, Fluid Mechanics","Aspen HYSYS, Simulink, MATLAB",Git,"Leadership, Teamwork","MATLAB, Simulink",
Chemical Process Researcher,"Chemical Research, Process Development, Reaction Engineering","MATLAB, COMSOL Multiphysics, Aspen Plus",Git,"Critical Thinking, Problem Solving","AutoCAD, LabVIEW",
Wastewater Treatment Engineer,"Wastewater Treatment, Chemical Engineering, Process Design","COMSOL Multiphysics, MATLAB, EPANET",Git,"Attention to Detail, Teamwork","MATLAB, Aspen Plus",
Bioengineering Process Consultant,"Bioengineering, Process Control, Chemical Synthesis","MATLAB, COMSOL Multiphysics, Simulink",Git,"Analytical Thinking, Creativity","AutoCAD, Simulink",
Process Systems Engineer,"Process Systems Design, Control Systems, Chemical Engineering","Simulink, MATLAB, Aspen Plus",Git,"Analytical Thinking, Problem Solving","AutoCAD, Simulink",
Chemical Manufacturing Process Engineer,"Manufacturing Processes, Chemical Engineering, Process Design","Aspen Plus, MATLAB, Simulink",Git,"Leadership, Problem Solving","AutoCAD, Simulink",
Pharmaceutical R&D Engineer,"Drug Development, Chemical Reactions, Process Engineering","MATLAB, Simulink, COMSOL Multiphysics",Git,"Teamwork, Analytical Thinking","AutoCAD, LabVIEW",
Process Safety Consultant,"Process Safety, Risk Assessment, Hazard Analysis","PHAST, MATLAB, Simulink",Git,"Attention to Detail, Communication","AutoCAD, SolidWorks",
Oilfield Process Engineer,"Oilfield Operations, Chemical Engineering, Process Control","Aspen HYSYS, MATLAB, COMSOL Multiphysics",Git,"Problem Solving, Teamwork","AutoCAD, Simulink",
Chemical Manufacturing Specialist,"Manufacturing Processes, Chemical Engineering, Process Design","MATLAB, Aspen Plus, SolidWorks",Git,"Problem Solving, Collaboration","Simulink, AutoCAD",
Petrochemical Design Engineer,"Petrochemical Engineering, Process Design, Fluid Mechanics","Aspen Plus, AutoCAD, COMSOL Multiphysics",Git,"Leadership, Problem Solving","MATLAB, Simulink",
Process Development Specialist,"Process Development, Chemical Reactions, Process Engineering","Aspen Plus, MATLAB, Simulink",Git,"Problem Solving, Analytical Thinking","AutoCAD, LabVIEW",
Renewable Energy Engineer,"Renewable Energy Systems, Process Control, Chemical Engineering","HOMER Energy, MATLAB, EnergyPlus",Git,"Leadership, Analytical Thinking","AutoCAD, SolidWorks",
Chemical Risk Management Engineer,"Risk Assessment, Chemical Engineering, Process Safety","MATLAB, PHAST, Simulink",Git,"Attention to Detail, Problem Solving","Simulink, AutoCAD",
Automated Process Engineer,"Automation, Process Control, PLC Programming","PLC Programming (Siemens TIA Portal), MATLAB, LabVIEW",Git,"Problem Solving, Technical Writing","SCADA, Excel",
Chemical Reactor Design Engineer,"Reactor Design, Chemical Reactions, Process Design","COMSOL Multiphysics, MATLAB, Aspen Plus",Git,"Analytical Thinking, Problem Solving","AutoCAD, Simulink",
Process Technology Engineer,"Process Technology, Chemical Engineering, Process Design","Simulink, Aspen Plus, MATLAB",Git,"Problem Solving, Creativity","AutoCAD, LabVIEW",
Energy Technology Engineer,"Energy Technology, Process Optimization, Chemical Engineering","EnergyPlus, MATLAB, HOMER Energy",Git,"Problem Solving, Collaboration","AutoCAD, SolidWorks",
Chemical Simulation Expert,"Simulation Techniques, Process Design, Chemical Engineering","Aspen Plus, MATLAB, COMSOL Multiphysics",Git,"Problem Solving, Teamwork","AutoCAD, Simulink",
Chemical Reaction Engineer,"Chemical Reactions, Process Design, Reaction Kinetics","COMSOL Multiphysics, MATLAB, Aspen Plus",Git,"Analytical Thinking, Problem Solving","AutoCAD, Simulink",
Biochemical Research Engineer,"Biochemical Engineering, Chemical Reactions, Process Design","MATLAB, COMSOL Multiphysics, Simulink",Git,"Creative Thinking, Analytical Thinking","AutoCAD, LabVIEW",
Process Engineering Manager,"Process Design, Optimization, Chemical Engineering","Microsoft Project, Simulink, MATLAB",Git,"Leadership, Problem Solving","AutoCAD, Simulink",
Plant Systems Engineer,"Plant Operations, Process Design, Chemical Engineering","AutoCAD, Revit, MATLAB",Git,"Teamwork, Analytical Thinking","AutoCAD, SolidWorks",
Industrial Chemical Engineer,"Industrial Processes, Process Design, Chemical Engineering","MATLAB, COMSOL Multiphysics, Aspen Plus",Git,"Problem Solving, Communication","Simulink, AutoCAD",
Water Treatment Systems Engineer,"Water Treatment, Chemical Engineering, Process Design","COMSOL Multiphysics, MATLAB, EPANET",Git,"Problem Solving, Attention to Detail","LabVIEW, AutoCAD",
Energy System Process Consultant,"Energy Management, Process Optimization, Chemical Engineering","MATLAB, EnergyPlus, HOMER Energy",Git,"Leadership, Analytical Thinking","AutoCAD, Simulink",
Biotechnology Engineer,"Biotechnology, Chemical Engineering, Process Control","MATLAB, COMSOL Multiphysics, Simulink",Git,"Problem Solving, Analytical Thinking","Simulink, AutoCAD",
Chemical Process Control Expert,"Process Control, Chemical Engineering, Control Systems","Simulink, MATLAB, Honeywell Experion",Git,"Analytical Thinking, Problem Solving","AutoCAD, LabVIEW",
Food Process Engineer,"Food Processing, Chemical Engineering, Process Design","MATLAB, Simulink, COMSOL Multiphysics",Git,"Teamwork, Analytical Thinking","AutoCAD, Simulink",
Chemical Engineering Lecturer,"Chemical Engineering, Process Design, Reaction Engineering","MATLAB, Simulink, LabVIEW",Git,"Communication, Teaching","AutoCAD, LabVIEW",
Pharmaceutical Systems Engineer,"Pharmaceutical Manufacturing, Process Control, Chemical Engineering","MATLAB, Simulink, COMSOL Multiphysics",Git,"Attention to Detail, Problem Solving","AutoCAD, Simulink",
